
You cry out in your sleep,
All my failings exposed.
And there's a taste in my mouth,
As desperation takes hold.
Just that something so good
Just can't function no more.

But love, love will tear us apart again.
Love, love will tear us apart again.
Love, love will tear us apart again.
Love, love will tear us apart again.



So long sitting here,
Didn't hear the warning.
Waiting for the tape to run.
We've been moving around in different situations,
Knowing that the time would come.
Just to see you torn apart,
Witness to your empty heart.
I need it.
I need it.
I need it.

Through the wire screen, the eyes of those standing outside looked in at her as into the cage of some rare creature in a zoo.
In the hand of one of the assistants she saw the same instrument which they had that morning inserted deep into her body. She shuddered instinctively. No life at all in the house of dolls.
No love lost.  No love lost.

You've been seeing things,
In darkness, not in learning,
Hoping that the truth will pass.
No life underground, wasting never changing,
Wishing that this day won't last.
To never see you show your age,
To watch until the beauty fades.
I need it.
I need it.
I need it.

Two-way mirror in the hall,
They like to watch everything you do,
Transmitters hidden in the walls,
So they know everything you say is true,
Turn it on,
Don't turn it on,
Turn it on.



Don't speak of safe Messiahs,
A failure of the Modern Man,
To the centre of all life's desires,
As a whole not an also ran.
Love in a hollow field,
Break the image of your father's son,
Drawn to an inner feel,
He was thought of as the only one,
He was thought of as the only one.

He no longer denies,
All the failures of the Modern Man,
No, no, no, he can't pick sides,
Sees the failures of the Modern Man.
Wise words and sympathy,
Tell the story of our history.
New strength gives a real touch,
Sense and reason make it all too much.
With a strange fatality,
Broke the spirits of a lesser man,
Some other race can see,
In his way he was the only one,
In his way he was the only one.

He no longer denies,
All the failures of the Modern Man,
No, no, no, he can't pick sides,
Sees the failures of the Modern Man.
Now that it's right to decide,
In his time he was a total man,
Taken from Caesar's side,
Kept in silence just to prove who's wrong.
He no longer denies,
All the failures of the Modern Man,
No, no, no, he can't pick sides,
Sees the failures of the Modern Man.
All the failures of the Modern Man.



Hearts fail, young hearts fail,
Anytime, pressurised,
Overheat, overtired,
Take it quick, take it neat,
Clasp your hands, touch your feet,
Take it quick, take it neat,
Take it quick, take it neat.

Hearts fail, young hearts fail,
Anytime, wearing down,
On the run, underground,
Put your hand where it's safe,
Leave your hand where it's safe.

Do it again,
Do it again and again and again...

Anytime, that's your right.
Don't you wish you do it again,
Overheat, overtired.
Don't you wish you do it again...
Anytime, that's your right...
Don't you wish you do it again...
I bet you wish you do it again
Do it again...



No I don't know just why.
No I don't know just why.
Which way to turn,
I got this ticket ot use.

Through childlike ways rebellion and crime,
To reach this point and retreat back again.
The broken hearts,
All the wheels that have turned,
The memories scarred and the vision is blurred.

No I don't know which way,
Don't know which way to turn,
The best possible use.

Just passing through, 'till we reach the next stage.
But just to where, well it's all been arranged.
Just passing through but the break must be made.
Should we move on or stay safely away?

Through childlike ways rebellion and crime,
To reach this point and retreat back again.
The broken hearts,
All the wheels that have turned,
The memories scarred and the vision is blurred.

Just passing through, 'till we reach the next stage.
But just to where, well it's all been arranged.
Just passing through but the break must be made.
Should we move on or stay safely away?



When the people listen to you, don't you know it means a lot
'Cause you've got to work so hard for everything you've got
Can't rest on your laurels now - not when you've got none
You'll find yourself in the gutter, right back where you came from

Someone told me being in the know is the main thing
We all need the security that belonging brings
Can't stand on your own in these times against all the odds
I don't want to act uncool like all the other sods

You slap our backs and pretend you knew
About all the things that we were gonna do
What ya gonna do, what ya gonna do when it's over?

You're all on your own now - don't you think that it's a shame
But you're the only one responsible to take the blame
When ya gonna grow up and act, and be yourself
Cause pretty soon you'll find yourself nailed to the shelf
Grab it while you can, but don't ever relax
Cause there's always someone gonna stab your back
What ya gonna do, what ya gonna do when it's over?



This is the hour when the mysteries emerge.
A strangeness so hard to reflect.
A moment so moving, goes straight to your heart,
The vision has never been met.
The attraction is held like a weight deep inside,
Something I'll never forget.

The pattern is set, her reaction will start,
Complete but rejected too soon.
Looking ahead in the grip of each fear,
Recalls the life that we knew.
The shadow that stood by the side of the road,
Always reminds me of you.

How can I find the right way to control,
All the conflict inside, all the problems beside,
As the questions arise, and the answers don't fit,
Into my way of things,
Into my way of things.



Morning seems strange, almost out of place.
Searched hard for you and your special ways.
These days, these days.

Spent all my time, learnt a killer's art.
Took threats and abuse 'till I'd learned the part.
Can you stay for these days?

These days, these days.

Used outward deception to get away,
Broken heart romance to make it pay.

These days, these days.

We'll drift through it all, it's the modern age.
Take care of it all now these debts are paid.
Can you stay for these days?



Why must we be put down when we try to get away?
Why must we all grow up when we could just play and play?
Good things in life are free, can't buy everything, that's true
Only one thing wrong with that, what it don't buy I don't use

Only thing I'm thinking of is "Why are we all here?"
There must be more to do at night than drinking rotten beer
The world's a very shady place, and you can't trust a soul
"Grin and bear it" seemed the thing, when it just gets a hold
At a later date - it might come out a fright
At a later date - I hope that you're alright

Human beings are dangerous and they call me in the dark
But everything gets twice as cold in marching for a lark
There's loads of things I'd like to do if I could find the time
Working really tires me and I think I'll turn to crime
At a later date - I hope they start it soon
At a later date - before we hit the moon

I just can't be bothered to make an effort here at all
People make you feel your contributions are too small
At a later date - I'll be awful great
At a later date - someone somewhere blew it
At a later date - at a later date



Warsaw!

Don't talk to me girl - you know it's not nice
Don't laugh at murder - I won't pay the price
The facts are too high-powered - it's such a big thrill
I'd do it myself, 'cause it makes you so ill

Blame bad things on me, whatever you do
When I come home my world is different from you
You're such a chic tart - you're really dressed up
Don't wanna talk to you - just left with your mum

Don't be a puppet - always rush you around
One just for your photo - try and tie me down
I won't tell him I talk like this all night
He must be worried 'cause you're sounding so trite

Respect is only normal - the way to your lives
Ever tried to sleep around - once I begged for a wife
Wouldn't have to change you - start acting that way
If we don't keep our heads alive, I'll never get a say
You know what's special - it's as black as I say
Can you see me, just ourselves - no comment, copycat!



Caressing the marble and stone,
Love that was special for one,
The waste in the fever I heat,
How I wish you were here with me now.

Body that curls in and dies,
And shares that awful daylight,
Warm like a dog round your feet,
How I wish you were here with me now.

Hangman looks round as he waits,
Cord stretches tight then it breaks,
Someday we will die in your dreams,
How I wish we were here with you now.



Hey you! You too!
I could make the choice for you
Dirt sticks close to you - it's all around me
Everything I try to do
I can't even seem to find the room to move

But you think you're number one
Actors though the film has gone
Crowded in a room for one
Darkness when the lights are on
Turn me on for good - it's so exciting
Slogans on the wall don't need no advertising
I can't even seem to find the room to move

Shackled up in fantasy
Hoping for some time to breathe
Suffocation comes too easy
I just want some time to breathe
Dirt sticks close to you - it's all around me
Everything I do - they're always trying to crowd me
I can't even seem to find the room to move

Watching every move I make
Choice of one that's hard to take
In fact it's just a big mistake
The effects that make it feel like you
Maggots run inside the line
Ready for the perfect crime
Say there is no right or wrong
I don't know what's right or wrong
I don't know what's right or wrong



Seen the troubles and the evils of this world
I've seen the stretches between godliness and sin
I've had the promise and confessions of true faith
And the hypocrisy that always lies within
And they left it for you - all of this for you -

I've seen the products and the other world of waste
I've seen the colour of corruption deep within
I've seen them lose themselves in dignity and taste
To see in black and white and through to black again
And they left it for you - all of this for you -

And they left it for you - all of this for you
And they left it for you - everything for you
I've seen the troubles and the evils of this world
I've seen the ones who can succeed but always lose
I've seen what's left of poor technology and work
And watched them dying as they leave their ship of fools
And they left it for you - all of this for you -



Don't know what I'm doing - don't know where I'm going
Leading me to ruin - I should have traded you in
Yeah you think you're something but you're no good for me

Don't know if I care - don't know if I'm there
I just sit and stare - making love to thin air
Yeah you're being insulted but you're no good for me
Na na na na na na na na no good -

I do lots of good - surprised at what you would
Don't call me no crud - I really think I'm good
Yeah you think you're something but you're no good for me

Try to call the tune - I'll probably go and rue it
I'll just get it groomed - all sorts of other clues
Yeah you're being insulted but you're no good for me

I get by the local peer group and their pressures
I can wash the dishes - my soups can taste delicious
Yeah you think you're something but you're no good for me

I've forgotten how you feel - to me you're looking real
Come on let's make a deal - think of where you live
Yeah you think you're something but you're no good for me
Na na na na na na na na no good -

I've forgotten how you feel - to me you're looking real
Come on let's make a deal - think of what you need
Yeah you're being insulted but you're no good for me
Yeah you're being insulted but you're no good for me

